"district","address","lng","lat","date"
"浦东新区","上海市浦东新区环湖南三路海港大道交界口工地生活区",121.894828827476,30.9001927274634,2022-06-05
"黄浦区","上海市黄浦区进贤路156弄",121.465757781993,31.2279512100499,2022-06-05
"黄浦区","上海市黄浦区已对相关居住地落实终末消毒措施等",121.491585592524,31.2372471520636,2022-06-05
"虹口区","上海市虹口区池沟路60弄",121.486056611941,31.3078208521029,2022-06-05
"虹口区","上海市虹口区昆明路56号",121.513452055418,31.2604099230377,2022-06-05
"虹口区","上海市虹口区6月5日已通报",121.511586454535,31.2697466989314,2022-06-05
"宝山区","上海市宝山区川路1498弄",121.435347535394,31.3674186164033,2022-06-05
"宝山区","上海市宝山区6月5日已通报",121.496563013525,31.4102794734761,2022-06-05
