"district","address","lng","lat","date"
"黄浦区","上海市黄浦区南昌路127弄",121.47018651798787,31.22281671345014,"2022-06-06"
"黄浦区","上海市黄浦区已对相关居住地落实终末消毒措施等",121.49158559252436,31.23724715206362,"2022-06-06"
"静安区","上海市静安区广延路1188弄",121.46172501906719,31.297661867844813,"2022-06-06"
"静安区","上海市静安区已对相关居住地落实终末消毒措施等",121.45343177276851,31.233844930401652,"2022-06-06"
"徐汇区","上海市徐汇区田林十一村",121.43199613719779,31.178479218266236,"2022-06-06"
"徐汇区","上海市徐汇区永嘉路172弄",121.46527512244262,31.215636175356266,"2022-06-06"
"徐汇区","上海市徐汇区已对相关居住地落实终末消毒措施等",121.44339635276381,31.194556772822725,"2022-06-06"
"虹口区","上海市虹口区池沟路60弄",121.486056611941,31.307820852102928,"2022-06-06"
"虹口区","上海市虹口区瑞虹路40弄",121.5048272445553,31.26632196978412,"2022-06-06"
