"district","address","lng","lat","date"
"浦东新区","上海市浦东新区北蔡镇南新村吴家宅",121.549849598071,31.1721417237226,2022-05-11
"浦东新区","上海市浦东新区北蔡镇卫行村",121.587201410668,31.1666652020159,2022-05-11
"浦东新区","上海市浦东新区北蔡镇五星村陈家队奚家宅",121.578579474383,31.194413133383,2022-05-11
"浦东新区","上海市浦东新区北蔡镇御桥村印家队东印家圈",121.564637683037,31.1740750417323,2022-05-11
"浦东新区","上海市浦东新区北蔡镇中界村陆家队陆家宅",121.507419754257,31.1905632054564,2022-05-11
"浦东新区","上海市浦东新区博山东路20弄",121.566038859972,31.2533910234004,2022-05-11
"浦东新区","上海市浦东新区博山路11弄",121.564218982839,31.2518921585341,2022-05-11
"浦东新区","上海市浦东新区长岛路1267弄",121.601522825921,31.268319782292,2022-05-11
"浦东新区","上海市浦东新区长清路693弄",121.536884264815,31.1897022555378,2022-05-11
"浦东新区","上海市浦东新区昌里路340弄",121.500968393576,31.1782390828587,2022-05-11
"浦东新区","上海市浦东新区陈春路620弄",121.552907609688,31.1780781941088,2022-05-11
"浦东新区","上海市浦东新区成山路24弄",121.492308997952,31.1741468770644,2022-05-11
"浦东新区","上海市浦东新区成山路668弄",121.519473037929,31.1758708312841,2022-05-11
"浦东新区","上海市浦东新区德平路1125弄",121.57509494731,31.2490535802043,2022-05-11
"浦东新区","上海市浦东新区峨山路605弄",121.528446660821,31.2208930478396,2022-05-11
"浦东新区","上海市浦东新区繁锦路688弄",121.5896261169,31.2815848989426,2022-05-11
"浦东新区","上海市浦东新区芳华路371弄",121.564425503276,31.2030206854988,2022-05-11
"浦东新区","上海市浦东新区芳华路63号",121.558171590146,31.200731052684,2022-05-11
"浦东新区","上海市浦东新区高科西路2763弄",121.559901007914,31.1968318840657,2022-05-11
"浦东新区","上海市浦东新区高桥镇陆凌村瞿家宅",121.570109621221,31.3523997058498,2022-05-11
"浦东新区","上海市浦东新区高桥镇西浜头",121.615635834297,31.2925041992064,2022-05-11
"浦东新区","上海市浦东新区高青路4567弄",121.536884264815,31.1897022555378,2022-05-11
"浦东新区","上海市浦东新区崮山路968号",121.568139277915,31.2414287626101,2022-05-11
"浦东新区","上海市浦东新区海纳路129弄",121.67672465135,31.2983650765524,2022-05-11
"浦东新区","上海市浦东新区航头路988弄",121.606904664062,31.0406249008946,2022-05-11
"浦东新区","上海市浦东新区航头镇航东村航头",121.599367880834,31.036557643002,2022-05-11
"浦东新区","上海市浦东新区合庆镇向东村马家宅",121.750008504685,31.2419070879143,2022-05-11
"浦东新区","上海市浦东新区和炯路77弄",121.525530311983,31.1391594184198,2022-05-11
"浦东新区","上海市浦东新区鹤永路751弄",121.610426021661,31.0775687255746,2022-05-11
"浦东新区","上海市浦东新区沪南路2688弄",121.570334646751,31.1439723553759,2022-05-11
"浦东新区","上海市浦东新区环桥路1137弄",121.584859707864,31.1200779398788,2022-05-11
"浦东新区","上海市浦东新区季景北路286弄",121.589325004893,31.3486485701932,2022-05-11
"浦东新区","上海市浦东新区济阳路65弄",121.488308933346,31.1730161980026,2022-05-11
"浦东新区","上海市浦东新区佳林路959号",121.619505464942,31.2707878589949,2022-05-11
"浦东新区","上海市浦东新区金海路华谐路交界口工地生活区",121.666189054838,31.269792842638,2022-05-11
"浦东新区","上海市浦东新区金桥路1504弄",121.596805105044,31.2559887622364,2022-05-11
"浦东新区","上海市浦东新区金桥路2552弄",121.609184383785,31.2399130333655,2022-05-11
"浦东新区","上海市浦东新区金桥路2618号",121.610079994379,31.2389558967816,2022-05-11
"浦东新区","上海市浦东新区金湘路201弄",121.619764626082,31.261871069581,2022-05-11
"浦东新区","上海市浦东新区金杨路660弄",121.588399929879,31.2575016841727,2022-05-11
"浦东新区","上海市浦东新区康桥路90弄",121.584859707864,31.1200779398788,2022-05-11
"浦东新区","上海市浦东新区科农路99弄",121.636263803384,31.1944164540822,2022-05-11
"浦东新区","上海市浦东新区崂山三村",121.526396817478,31.2389325085635,2022-05-11
"浦东新区","上海市浦东新区崂山四村",121.524541996261,31.2411728108698,2022-05-11
"浦东新区","上海市浦东新区历城路100弄",121.4979155023,31.1798977733905,2022-05-11
"浦东新区","上海市浦东新区林展路267弄",121.513993014996,31.133678885242,2022-05-11
"浦东新区","上海市浦东新区林展路278弄",121.512901034818,31.1328058217041,2022-05-11
"浦东新区","上海市浦东新区灵山路1724弄",121.574529733483,31.2463031356353,2022-05-11
"浦东新区","上海市浦东新区灵岩南路156弄",121.500710759556,31.1648391859701,2022-05-11
"浦东新区","上海市浦东新区凌兆路127弄",121.500027777877,31.1477960721254,2022-05-11
"浦东新区","上海市浦东新区龙居路180弄",121.568971737631,31.2585512381558,2022-05-11
"浦东新区","上海市浦东新区南码头路1675弄",121.520848882648,31.1809040184718,2022-05-11
"浦东新区","上海市浦东新区浦东大道136弄",121.520173536566,31.2440242095398,2022-05-11
"浦东新区","上海市浦东新区浦东大道140弄",121.521669035579,31.2440488314387,2022-05-11
"浦东新区","上海市浦东新区浦东大道1851弄",121.552497443392,31.2531016867014,2022-05-11
"浦东新区","上海市浦东新区浦东大道2639弄",121.573829414507,31.2700964028423,2022-05-11
"浦东新区","上海市浦东新区浦东大道2742弄",121.577979316472,31.2729270889842,2022-05-11
"浦东新区","上海市浦东新区浦东南路1700弄",121.525060767693,31.2237849777418,2022-05-11
"浦东新区","上海市浦东新区浦三路5127弄",121.536884264815,31.1897022555378,2022-05-11
"浦东新区","上海市浦东新区乳山路161弄",121.528018079262,31.2415971840306,2022-05-11
"浦东新区","上海市浦东新区瑞阳路81弄",121.594743853221,31.1053716682663,2022-05-11
"浦东新区","上海市浦东新区三林路200号",121.502844953786,31.1424192736674,2022-05-11
"浦东新区","上海市浦东新区三林镇胡巷村金家宅",121.52500489309,31.1587157705195,2022-05-11
"浦东新区","上海市浦东新区三林镇胡巷村吴家宅",121.525354423764,31.1666240285963,2022-05-11
"浦东新区","上海市浦东新区三林镇天花庵村北陈队大陈家宅",121.531939542135,31.1285359001772,2022-05-11
"浦东新区","上海市浦东新区三林镇天花庵村东瞿队大瞿家宅",121.532611205165,31.1270776188598,2022-05-11
"浦东新区","上海市浦东新区三林镇西林村圈门队西林街",121.505050473475,31.1424654028824,2022-05-11
"浦东新区","上海市浦东新区三林镇新任村",121.502813063941,31.1618677203956,2022-05-11
"浦东新区","上海市浦东新区上南路4265弄",121.519804782154,31.1518099263142,2022-05-11
"浦东新区","上海市浦东新区世博家园大道站路94弄",121.545610314708,31.1654593463491,2022-05-11
"浦东新区","上海市浦东新区思浦路17弄",121.499381626723,31.1638258159296,2022-05-11
"浦东新区","上海市浦东新区台儿庄路363弄",121.600337960954,31.264978881782,2022-05-11
"浦东新区","上海市浦东新区五莲路108弄",121.588773624971,31.2771578731139,2022-05-11
"浦东新区","上海市浦东新区西泰林路901弄",121.54507097208,31.1494599367676,2022-05-11
"浦东新区","上海市浦东新区西营路33弄",121.490422736042,31.1765666914554,2022-05-11
"浦东新区","上海市浦东新区下南路370弄",121.536884264815,31.1897022555378,2022-05-11
"浦东新区","上海市浦东新区下南路500弄",121.543720818899,31.1779675877605,2022-05-11
"浦东新区","上海市浦东新区新场镇蒋桥村",121.667276184166,31.0543212498287,2022-05-11
"浦东新区","上海市浦东新区新场镇坦西村坦北",121.651215559614,31.0897996061926,2022-05-11
"浦东新区","上海市浦东新区新浦路543弄",121.536926664835,31.1758010055361,2022-05-11
"浦东新区","上海市浦东新区新浦路629弄",121.542012690971,31.1775770659788,2022-05-11
"浦东新区","上海市浦东新区秀沿路2585弄",121.584859707864,31.1200779398788,2022-05-11
"浦东新区","上海市浦东新区秀沿路2875弄",121.616066481959,31.1449302308223,2022-05-11
"浦东新区","上海市浦东新区严桥路150弄",121.53448201622,31.1955148268081,2022-05-11
"浦东新区","上海市浦东新区杨新路20弄",121.502908553817,31.1704943282868,2022-05-11
"浦东新区","上海市浦东新区杨新路80弄",121.500333510246,31.1696131563215,2022-05-11
"浦东新区","上海市浦东新区耀华路414弄",121.492226982658,31.1790527910542,2022-05-11
"浦东新区","上海市浦东新区耀华路500弄",121.488759343729,31.1767943182538,2022-05-11
"浦东新区","上海市浦东新区懿行路971弄",121.51939497518,31.1311335477655,2022-05-11
"浦东新区","上海市浦东新区银山路370弄",121.590757442859,31.2520815535262,2022-05-11
"浦东新区","上海市浦东新区永泰路2079弄",121.525530311983,31.1391594184198,2022-05-11
"浦东新区","上海市浦东新区韵涛路36弄",121.584859707864,31.1200779398788,2022-05-11
"浦东新区","上海市浦东新区枣庄路210弄",121.577389219582,31.2643915592667,2022-05-11
"浦东新区","上海市浦东新区枣庄路212弄",121.577860650314,31.2641916172029,2022-05-11
"浦东新区","上海市浦东新区张杨北路512弄",121.595559065471,31.2713992930251,2022-05-11
"浦东新区","上海市浦东新区赵高公路958号",121.637129320743,31.3168728490792,2022-05-11
"浦东新区","上海市浦东新区紫叶路81弄",121.557722167899,31.1897187054085,2022-05-11
"浦东新区","上海市浦东新区邹平路191号工地生活区",121.521600584699,31.1763068548283,2022-05-11
"黄浦区","上海市黄浦区半淞园路650号",121.501021393601,31.2042314632707,2022-05-11
"黄浦区","上海市黄浦区保屯路211弄",121.498305816045,31.209535149529,2022-05-11
"黄浦区","上海市黄浦区成都北路262弄",121.474451223396,31.2349910085444,2022-05-11
"黄浦区","上海市黄浦区长乐路79号",121.475005298235,31.2280700947546,2022-05-11
"黄浦区","上海市黄浦区重庆北路177弄",121.476319968349,31.2325548713123,2022-05-11
"黄浦区","上海市黄浦区重庆南路205弄",121.477585501151,31.2205009292658,2022-05-11
"黄浦区","上海市黄浦区打浦路316弄",121.477142906027,31.2052986798579,2022-05-11
"黄浦区","上海市黄浦区打浦路470弄",121.479363247756,31.2030630784288,2022-05-11
"黄浦区","上海市黄浦区大夫坊95弄",121.491585592524,31.2372471520636,2022-05-11
"黄浦区","上海市黄浦区大沽路159号",121.477727882575,31.2321308430994,2022-05-11
"黄浦区","上海市黄浦区大林路43弄",121.49331950182,31.219241105019,2022-05-11
"黄浦区","上海市黄浦区淡水路214弄",121.479010483182,31.2233875443681,2022-05-11
"黄浦区","上海市黄浦区淡水路216号",121.479799015758,31.2233480943044,2022-05-11
"黄浦区","上海市黄浦区淡水路225弄",121.479878246304,31.2227551833205,2022-05-11
"黄浦区","上海市黄浦区淡水路228号",121.479637230936,31.2231540862149,2022-05-11
"黄浦区","上海市黄浦区方斜路409号",121.489935584964,31.2202575817683,2022-05-11
"黄浦区","上海市黄浦区福建中路195弄",121.488057048481,31.2395095706142,2022-05-11
"黄浦区","上海市黄浦区福建中路225号",121.487760697493,31.2401062348282,2022-05-11
"黄浦区","上海市黄浦区福州路384弄",121.489639054315,31.2400334466292,2022-05-11
"黄浦区","上海市黄浦区福州路614弄",121.485855032185,31.2389698679587,2022-05-11
"黄浦区","上海市黄浦区复兴东路404弄",121.503635193144,31.2268925119336,2022-05-11
"黄浦区","上海市黄浦区牯岭路172号",121.477107333128,31.241909403506,2022-05-11
"黄浦区","上海市黄浦区广西北路200号",121.484809404571,31.2385372236355,2022-05-11
"黄浦区","上海市黄浦区海潮路93弄",121.505912038289,31.2149615288345,2022-05-11
"黄浦区","上海市黄浦区海口路9号",121.487527138061,31.237148039744,2022-05-11
"黄浦区","上海市黄浦区海南西弄93号",121.503199155649,31.2167001736837,2022-05-11
"黄浦区","上海市黄浦区河南南路1001弄",121.49979358963,31.219506535756,2022-05-11
"黄浦区","上海市黄浦区河南中路575弄",121.490140847773,31.2459055663665,2022-05-11
"黄浦区","上海市黄浦区淮海中路526弄",121.475825002013,31.2273074544703,2022-05-11
"黄浦区","上海市黄浦区淮海中路899弄",121.466966002904,31.2231499945159,2022-05-11
"黄浦区","上海市黄浦区淮海中路925弄",121.466481367081,31.223147524056,2022-05-11
"黄浦区","上海市黄浦区黄河路215弄",121.434456955312,31.2533728868238,2022-05-11
"黄浦区","上海市黄浦区黄河路239号",121.4760266716,31.2428547004673,2022-05-11
"黄浦区","上海市黄浦区黄河路253弄",121.475294193287,31.242852770827,2022-05-11
"黄浦区","上海市黄浦区黄河路261号",121.475813593533,31.2430448856206,2022-05-11
"黄浦区","上海市黄浦区黄河路281弄",121.475632764634,31.2434464806782,2022-05-11
"黄浦区","上海市黄浦区黄河路288号",121.47590926307,31.2434954160334,2022-05-11
"黄浦区","上海市黄浦区黄家阙路68弄",121.493950022457,31.2207148614576,2022-05-11
"黄浦区","上海市黄浦区建国东路115弄",121.477432699384,31.2143144411244,2022-05-11
"黄浦区","上海市黄浦区建国东路143弄",121.485327098036,31.2182331870898,2022-05-11
"黄浦区","上海市黄浦区建国东路61弄",121.486442404214,31.219232432313,2022-05-11
"黄浦区","上海市黄浦区建国西路91弄",121.478096367495,31.2181663267346,2022-05-11
"黄浦区","上海市黄浦区江滨路258号",121.47813957599,31.1973864248866,2022-05-11
"黄浦区","上海市黄浦区江西中路412弄",121.492185570774,31.2467273311509,2022-05-11
"黄浦区","上海市黄浦区江西中路44弄",121.494733344862,31.2385833827505,2022-05-11
"黄浦区","上海市黄浦区江阴街401弄",121.494666061779,31.2185822344276,2022-05-11
"黄浦区","上海市黄浦区进贤路138弄",121.466170463544,31.2278474560023,2022-05-11
"黄浦区","上海市黄浦区聚奎新村",121.502708501179,31.2294960046602,2022-05-11
"黄浦区","上海市黄浦区丽园路1016弄",121.478937810266,31.2107348789637,2022-05-11
"黄浦区","上海市黄浦区丽园路502号",121.488570879233,31.2136336855106,2022-05-11
"黄浦区","上海市黄浦区丽园路883号",121.48180780654,31.2126339687374,2022-05-11
"黄浦区","上海市黄浦区柳市路1弄",121.491585592524,31.2372471520636,2022-05-11
"黄浦区","上海市黄浦区龙华东路888弄",121.477730128338,31.1990606070333,2022-05-11
"黄浦区","上海市黄浦区鲁班路509弄",121.483254078411,31.2067494139374,2022-05-11
"黄浦区","上海市黄浦区陆家浜路1256弄",121.491440695846,31.2171967690106,2022-05-11
"黄浦区","上海市黄浦区陆家浜路413弄",121.505863709453,31.2173034687199,2022-05-11
"黄浦区","上海市黄浦区陆家浜路468弄",121.504498105416,31.2161071433814,2022-05-11
"黄浦区","上海市黄浦区陆家浜路688弄",121.501678953234,31.2180530654927,2022-05-11
"黄浦区","上海市黄浦区马当路278弄",121.480389561801,31.2236803698593,2022-05-11
"黄浦区","上海市黄浦区蒙自路345弄",121.485623179532,31.21018620811,2022-05-11
"黄浦区","上海市黄浦区蒙自路601弄",121.487528126197,31.2051225486478,2022-05-11
"黄浦区","上海市黄浦区面筋弄29号",121.504795534371,31.2263274151385,2022-05-11
"黄浦区","上海市黄浦区南昌路246号",121.471194506601,31.2238613298419,2022-05-11
"黄浦区","上海市黄浦区南车站路169弄",121.497902836193,31.2151263691007,2022-05-11
"黄浦区","上海市黄浦区南车站路438号",121.499896535442,31.2110261997977,2022-05-11
"黄浦区","上海市黄浦区南京东路600号",121.485620215124,31.2416532987079,2022-05-11
"黄浦区","上海市黄浦区南京西路461号",121.474769313378,31.2367739747004,2022-05-11
"黄浦区","上海市黄浦区宁波路540号",121.483899960073,31.2428860378203,2022-05-11
"黄浦区","上海市黄浦区宁波路601号",121.482766208689,31.2424740202567,2022-05-11
"黄浦区","上海市黄浦区平望街36弄",121.48569944567,31.2377620095423,2022-05-11
"黄浦区","上海市黄浦区普育东路101弄",121.502876214818,31.2152174750717,2022-05-11
"黄浦区","上海市黄浦区普育东路200弄",121.502308755228,31.2136236482467,2022-05-11
"黄浦区","上海市黄浦区普育东路230号",121.502204461958,31.2132980542624,2022-05-11
"黄浦区","上海市黄浦区瞿溪路1072弄",121.481430608056,31.2047559228658,2022-05-11
"黄浦区","上海市黄浦区瞿溪路117号",121.501438117527,31.2125793808676,2022-05-11
"黄浦区","上海市黄浦区瞿溪路1200弄",121.477917514868,31.2023023965439,2022-05-11
"黄浦区","上海市黄浦区瞿溪路120弄",121.50172216173,31.2120859266995,2022-05-11
"黄浦区","上海市黄浦区瞿溪路122号",121.50094297153,31.2119094994099,2022-05-11
"黄浦区","上海市黄浦区瞿溪路1240弄",121.477558192664,31.2030009175686,2022-05-11
"黄浦区","上海市黄浦区瞿溪路124号",121.500928149489,31.2119289566153,2022-05-11
"黄浦区","上海市黄浦区瞿溪路1254弄",121.476834158423,31.2024935135258,2022-05-11
"黄浦区","上海市黄浦区瞿溪路129号",121.500388267878,31.2118219419358,2022-05-11
"黄浦区","上海市黄浦区瞿溪路564号",121.49284187278,31.2067684861381,2022-05-11
"黄浦区","上海市黄浦区瞿溪路566号",121.492495306514,31.2072535518952,2022-05-11
"黄浦区","上海市黄浦区瞿溪路804号",121.487723866968,31.206642933847,2022-05-11
"黄浦区","上海市黄浦区瞿溪路883弄",121.485768974517,31.2063427195683,2022-05-11
"黄浦区","上海市黄浦区瞿溪路904弄",121.485646894798,31.2058076130278,2022-05-11
"黄浦区","上海市黄浦区瞿溪路937弄",121.484684090952,31.2063509816511,2022-05-11
"黄浦区","上海市黄浦区汝南街76号",121.490695551425,31.2084300691469,2022-05-11
"黄浦区","上海市黄浦区瑞金二路52弄",121.470646001256,31.2218631849024,2022-05-11
"黄浦区","上海市黄浦区瑞金二路70弄",121.470872104753,31.2213571183194,2022-05-11
"黄浦区","上海市黄浦区瑞金南路1号",121.474173108011,31.2107613627134,2022-05-11
"黄浦区","上海市黄浦区瑞金南路333弄",121.475677949401,31.2040478399445,2022-05-11
"黄浦区","上海市黄浦区顺昌路487号",121.48604996448,31.2190202209843,2022-05-11
"黄浦区","上海市黄浦区顺昌路506号",121.485848744046,31.218536528679,2022-05-11
"黄浦区","上海市黄浦区顺昌路594号",121.486170966232,31.2170928486269,2022-05-11
"黄浦区","上海市黄浦区四川中路627号",121.492684399824,31.248086735146,2022-05-11
"黄浦区","上海市黄浦区四牌楼路71号",121.502079597492,31.2299703767784,2022-05-11
"黄浦区","上海市黄浦区泗泾路29号",121.493204698376,31.2389392239931,2022-05-11
"黄浦区","上海市黄浦区天津路170弄",121.489594408531,31.2445117064947,2022-05-11
"黄浦区","上海市黄浦区吾园街142号",121.497558515691,31.2232211746129,2022-05-11
"黄浦区","上海市黄浦区五里桥路235弄",121.486606644405,31.2096501197617,2022-05-11
"黄浦区","上海市黄浦区西藏南路1383弄",121.49478679404,31.2111731338686,2022-05-11
"黄浦区","上海市黄浦区西凌家宅路111弄",121.493016593202,31.2103186275591,2022-05-11
"黄浦区","上海市黄浦区西凌家宅路27弄",121.493752125753,31.2105657842924,2022-05-11
"黄浦区","上海市黄浦区斜土东路265弄",121.493419752715,31.2132894839525,2022-05-11
"黄浦区","上海市黄浦区斜土东路333弄",121.492469525146,31.2131162245468,2022-05-11
"黄浦区","上海市黄浦区斜土路330弄",121.485718399917,31.2101785640661,2022-05-11
"黄浦区","上海市黄浦区斜土路530号",121.482802230739,31.2089081770726,2022-05-11
"黄浦区","上海市黄浦区斜土路80弄",121.490479149628,31.2107099394492,2022-05-11
"黄浦区","上海市黄浦区新昌路288号",121.474818091367,31.2418715821665,2022-05-11
"黄浦区","上海市黄浦区新昌路310弄",121.474665109938,31.2421756961782,2022-05-11
"黄浦区","上海市黄浦区新昌路332号",121.474409182699,31.2424627511109,2022-05-11
"黄浦区","上海市黄浦区兴安路141弄",121.477259955235,31.2266038652402,2022-05-11
"黄浦区","上海市黄浦区学院路70号",121.502550758732,31.228816671808,2022-05-11
"黄浦区","上海市黄浦区学院路79弄",121.502472695983,31.2290396170423,2022-05-11
"黄浦区","上海市黄浦区巡道街21号",121.504169954414,31.2263027113756,2022-05-11
"黄浦区","上海市黄浦区巡道街8号",121.504082100135,31.226523501025,2022-05-11
"黄浦区","上海市黄浦区延安东路1292弄",121.478033306448,31.2317579931103,2022-05-11
"黄浦区","上海市黄浦区浙江中路118弄",121.486697642753,31.2378334100933,2022-05-11
"黄浦区","上海市黄浦区制造局路365弄",121.491094399072,31.2109848914388,2022-05-11
"黄浦区","上海市黄浦区制造局路370弄",121.490967743528,31.2121753784511,2022-05-11
"黄浦区","上海市黄浦区制造局路455弄",121.491010407506,31.210925129407,2022-05-11
"黄浦区","上海市黄浦区制造局路529号",121.491455697548,31.2096017071961,2022-05-11
"黄浦区","上海市黄浦区制造局路567弄",121.491828673995,31.2093086060248,2022-05-11
"黄浦区","上海市黄浦区中山南路1669弄",121.501983838125,31.2107305550855,2022-05-11
"黄浦区","上海市黄浦区中山南路1726弄",121.49944953862,31.2099897019351,2022-05-11
"黄浦区","上海市黄浦区中山南路891号",121.513223795988,31.218398870859,2022-05-11
"黄浦区","上海市黄浦区中山南一路1043弄",121.479223022266,31.2019809330397,2022-05-11
"黄浦区","上海市黄浦区中山南一路198弄",121.495143062005,31.2064719786118,2022-05-11
"黄浦区","上海市黄浦区中山南一路247弄",121.492960718599,31.2063049610685,2022-05-11
"黄浦区","上海市黄浦区中山南一路904号",121.482043342245,31.2021998495742,2022-05-11
"黄浦区","上海市黄浦区庄家街34号",121.494785446581,31.226400291201,2022-05-11
"黄浦区","上海市黄浦区自忠路428号",121.479222932435,31.2240606633427,2022-05-11
"静安区","上海市静安区宝山路499弄",121.484717238426,31.2636615487347,2022-05-11
"静安区","上海市静安区宝山路581号",121.48492169276,31.2650182371201,2022-05-11
"静安区","上海市静安区宝通路210号",121.484652201107,31.2620930871551,2022-05-11
"静安区","上海市静安区宝源路209弄",121.486628203737,31.2623012908521,2022-05-11
"静安区","上海市静安区保德路241弄",121.469495810881,31.3235062419465,2022-05-11
"静安区","上海市静安区昌平路421弄",121.454136134119,31.2418984430378,2022-05-11
"静安区","上海市静安区昌平路999弄",121.443925364879,31.2386810269573,2022-05-11
"静安区","上海市静安区常德路545弄",121.452313112917,31.2365490409351,2022-05-11
"静安区","上海市静安区常德路633弄",121.450978230929,31.2376848196961,2022-05-11
"静安区","上海市静安区长乐路638弄",121.460752603353,31.2252078649354,2022-05-11
"静安区","上海市静安区长临路200弄",121.44093562448,31.3200767753684,2022-05-11
"静安区","上海市静安区场中路2155弄",121.4571866898,31.3122913895242,2022-05-11
"静安区","上海市静安区场中路2965弄",121.444069902235,31.3111289053508,2022-05-11
"静安区","上海市静安区大统路933弄",121.466221397467,31.2615230326281,2022-05-11
"静安区","上海市静安区共和新路1304弄",121.465836653217,31.2700540402802,2022-05-11
"静安区","上海市静安区共和新路3616弄",121.454428981715,31.3089819120165,2022-05-11
"静安区","上海市静安区共和新路619弄",121.471503433865,31.2604662579375,2022-05-11
"静安区","上海市静安区共和新路655弄",121.470448014722,31.261024897661,2022-05-11
"静安区","上海市静安区共和新路966号",121.468580078244,31.2652664840375,2022-05-11
"静安区","上海市静安区广延路350弄",121.462225465067,31.2820130234457,2022-05-11
"静安区","上海市静安区海防路223弄",121.455221107514,31.2455437313246,2022-05-11
"静安区","上海市静安区海防路338弄",121.453221030296,31.2450848749331,2022-05-11
"静安区","上海市静安区汉中路18号",121.466608387481,31.2497506718354,2022-05-11
"静安区","上海市静安区汉中路28弄",121.453431772769,31.2338449304017,2022-05-11
"静安区","上海市静安区汉中路78弄",121.465700020949,31.2493749592327,2022-05-11
"静安区","上海市静安区沪太路1051弄",121.435839716983,31.2849668670001,2022-05-11
"静安区","上海市静安区沪太路549号",121.457410906856,31.2632729276941,2022-05-11
"静安区","上海市静安区沪太路651弄",121.455284797375,31.2674438057978,2022-05-11
"静安区","上海市静安区胶州路565弄",121.447087130782,31.2392638025142,2022-05-11
"静安区","上海市静安区康定路864号",121.447095664684,31.2374789540648,2022-05-11
"静安区","上海市静安区老沪太路1291弄",121.447781431111,31.2756099308133,2022-05-11
"静安区","上海市静安区老沪太路250弄",121.458982851667,31.2734609629028,2022-05-11
"静安区","上海市静安区临汾路99弄",121.455802041687,31.316900845253,2022-05-11
"静安区","上海市静安区临山路186号",121.480233346473,31.2606808704435,2022-05-11
"静安区","上海市静安区灵石路666弄",121.452108658583,31.2883274968453,2022-05-11
