"district","address","lng","lat","date"
"浦东新区","上海市浦东新区北艾路1077弄",121.540540368241,31.1863061063091,2022-05-09
"浦东新区","上海市浦东新区北蔡镇五星村陈家队陈家宅",121.578579474383,31.194413133383,2022-05-09
"浦东新区","上海市浦东新区北蔡镇杨桥村西计队金家宅",121.570644651983,31.1909809347657,2022-05-09
"浦东新区","上海市浦东新区北蔡镇中界村陆家队陆家宅",121.507419754257,31.1905632054564,2022-05-09
"浦东新区","上海市浦东新区北蔡镇中界村沈家队姚家宅",121.574173735009,31.1954461740634,2022-05-09
"浦东新区","上海市浦东新区北张家浜路188弄",121.531700772531,31.2222772233074,2022-05-09
"浦东新区","上海市浦东新区博兴路1663弄",121.60720101505,31.2807760939525,2022-05-09
"浦东新区","上海市浦东新区博兴路986弄",121.597262971363,31.270671034824,2022-05-09
"浦东新区","上海市浦东新区彩云路568弄",121.814337689374,30.905357779155,2022-05-09
"浦东新区","上海市浦东新区曹路镇顾三村黄家宅",121.682658228735,31.3010551326507,2022-05-09
"浦东新区","上海市浦东新区曹路镇光明村沙桥宅",121.658185512066,31.292967682843,2022-05-09
"浦东新区","上海市浦东新区曹路镇建新村叶家宅",121.688693494304,31.295365294467,2022-05-09
"浦东新区","上海市浦东新区曹路镇联合村路南宅",121.348674887586,31.408630188596,2022-05-09
"浦东新区","上海市浦东新区曹路镇联合村西柴场",121.67746314831,31.3033290423911,2022-05-09
"浦东新区","上海市浦东新区曹路镇民建村南邵家宅",121.654516473041,31.2803786713243,2022-05-09
"浦东新区","上海市浦东新区曹路镇新光村陆家宅",121.666333322703,31.2663713561625,2022-05-09
"浦东新区","上海市浦东新区曹路镇迅建村季家宅",121.697148794917,31.2892028145954,2022-05-09
"浦东新区","上海市浦东新区长岛路1201弄",121.596729737212,31.2693476089323,2022-05-09
"浦东新区","上海市浦东新区长岛路800弄",121.593834768045,31.2653075369301,2022-05-09
"浦东新区","上海市浦东新区长清路773弄",121.498012070143,31.1619738650998,2022-05-09
"浦东新区","上海市浦东新区长清路977弄",121.498704394199,31.1587757203579,2022-05-09
"浦东新区","上海市浦东新区昌里东路550弄",121.521399004942,31.1835358991941,2022-05-09
"浦东新区","上海市浦东新区昌里东路80弄",121.512747873728,31.1803744049484,2022-05-09
"浦东新区","上海市浦东新区昌里路340弄",121.500968393576,31.1782390828587,2022-05-09
"浦东新区","上海市浦东新区陈邵路101号生活区",121.639182570213,31.2933453833818,2022-05-09
"浦东新区","上海市浦东新区成山路1488弄",121.533431537757,31.1819798422434,2022-05-09
"浦东新区","上海市浦东新区成山路1728弄",121.535534201464,31.1818249843163,2022-05-09
"浦东新区","上海市浦东新区成山路24弄",121.492308997952,31.1741468770644,2022-05-09
"浦东新区","上海市浦东新区川周公路3010弄",121.617623155577,31.147196115555,2022-05-09
"浦东新区","上海市浦东新区川周路8288弄",121.715516642677,31.1838478903764,2022-05-09
"浦东新区","上海市浦东新区创新西路300弄",121.659610224605,31.2094711398488,2022-05-09
"浦东新区","上海市浦东新区创业路78弄",121.584859707864,31.1200779398788,2022-05-09
"浦东新区","上海市浦东新区大团镇团西村",121.739632177739,30.974409907501,2022-05-09
"浦东新区","上海市浦东新区德平路1065弄",121.57423419097,31.2492630478328,2022-05-09
"浦东新区","上海市浦东新区德平路1066弄",121.573972784066,31.2468356951989,2022-05-09
"浦东新区","上海市浦东新区德平路1125弄",121.57509494731,31.2490535802043,2022-05-09
"浦东新区","上海市浦东新区德平路730弄",121.571500018489,31.2516361582547,2022-05-09
"浦东新区","上海市浦东新区丁香路1089弄",121.562914194086,31.2347233059554,2022-05-09
"浦东新区","上海市浦东新区丁香路1599弄",121.572306876498,31.2338622988355,2022-05-09
"浦东新区","上海市浦东新区丁香路910弄",121.560392021706,31.2312404779508,2022-05-09
"浦东新区","上海市浦东新区东建新村",121.526861421087,31.2227134169234,2022-05-09
"浦东新区","上海市浦东新区东靖路247弄",121.584071175287,31.2986857459865,2022-05-09
"浦东新区","上海市浦东新区东陆路1268弄",121.601560554753,31.2728788634835,2022-05-09
"浦东新区","上海市浦东新区东三里桥路190弄",121.518021016903,31.2062437289496,2022-05-09
"浦东新区","上海市浦东新区东书房路390弄",121.541617795869,31.1696664870587,2022-05-09
"浦东新区","上海市浦东新区杜鹃路58弄",121.529696185109,31.2072012517119,2022-05-09
"浦东新区","上海市浦东新区繁锦路688弄",121.5896261169,31.2815848989426,2022-05-09
"浦东新区","上海市浦东新区芳甸路333弄",121.529696185109,31.2072012517119,2022-05-09
"浦东新区","上海市浦东新区芳华路188弄",121.536884264815,31.1897022555378,2022-05-09
"浦东新区","上海市浦东新区芳华路329弄",121.56365017579,31.202246644365,2022-05-09
"浦东新区","上海市浦东新区芳华路371弄",121.564425503276,31.2030206854988,2022-05-09
"浦东新区","上海市浦东新区芳华路411弄",121.565570303818,31.2023994608537,2022-05-09
"浦东新区","上海市浦东新区芳华路455弄",121.566150609177,31.2026175270033,2022-05-09
"浦东新区","上海市浦东新区芳华路63号",121.558171590146,31.200731052684,2022-05-09
"浦东新区","上海市浦东新区芳芯路312弄",121.564077499721,31.1971826328678,2022-05-09
"浦东新区","上海市浦东新区高东镇珊黄村苍头宅",121.646532423499,31.3365476898601,2022-05-09
"浦东新区","上海市浦东新区高东镇先锋村卢家宅",121.591521541526,31.2903783011154,2022-05-09
"浦东新区","上海市浦东新区高科西路2111弄",121.5423303318,31.1941812247261,2022-05-09
"浦东新区","上海市浦东新区高科西路3060弄",121.570701963874,31.1958678972719,2022-05-09
"浦东新区","上海市浦东新区高桥镇陆凌村西凌家宅",121.5817386352,31.3535668406377,2022-05-09
"浦东新区","上海市浦东新区高桥镇南塘村龚家宅",121.5746809183,31.345394276907,2022-05-09
"浦东新区","上海市浦东新区高桥镇南塘村顾家宅",121.5746809183,31.345394276907,2022-05-09
"浦东新区","上海市浦东新区高桥镇南塘村姚家宅",121.5746809183,31.345394276907,2022-05-09
"浦东新区","上海市浦东新区古棕路168弄",121.923877781905,30.8902665107794,2022-05-09
"浦东新区","上海市浦东新区海基三路海洋二路交界口工地生活区",121.894828827476,30.9001927274634,2022-05-09
"浦东新区","上海市浦东新区海鸣路98弄",121.677548217842,31.2886278337477,2022-05-09
"浦东新区","上海市浦东新区海鹏路301弄",121.680730914264,31.2953639830489,2022-05-09
"浦东新区","上海市浦东新区海阳路450弄",121.499191455447,31.1598918928277,2022-05-09
"浦东新区","上海市浦东新区航昌路鹤涟路交界口工地生活区",121.612806621093,31.0856466415301,2022-05-09
"浦东新区","上海市浦东新区航头镇果园村",121.642441899529,31.025361102765,2022-05-09
"浦东新区","上海市浦东新区航绣路50弄",121.60439363067,31.0765771467867,2022-05-09
"浦东新区","上海市浦东新区合庆镇勤奋村卫家宅",121.732101682649,31.2614765761563,2022-05-09
"浦东新区","上海市浦东新区和炯路77弄",121.525530311983,31.1391594184198,2022-05-09
"浦东新区","上海市浦东新区和龙路55弄",121.579757871748,31.3449552012399,2022-05-09
"浦东新区","上海市浦东新区鹤永路751弄",121.610426021661,31.0775687255746,2022-05-09
"浦东新区","上海市浦东新区鸿音路正茂路交界口工地生活区",121.836238198046,30.8856842871463,2022-05-09
"浦东新区","上海市浦东新区沪东路67号",121.586816756248,31.2773934340112,2022-05-09
"浦东新区","上海市浦东新区沪南路2688弄",121.570334646751,31.1439723553759,2022-05-09
"浦东新区","上海市浦东新区沪南路3158弄",121.572008728899,31.1277255406032,2022-05-09
"浦东新区","上海市浦东新区花木街道龙王庙村南杨家堂",121.558963805775,31.202723239483,2022-05-09
"浦东新区","上海市浦东新区花木路500弄",121.549098435004,31.2178118734071,2022-05-09
"浦东新区","上海市浦东新区花山路1001弄",121.588490748566,31.3561458336138,2022-05-09
"浦东新区","上海市浦东新区环林西路848弄",121.533353025855,31.1454492272542,2022-05-09
"浦东新区","上海市浦东新区环桥路1136弄",121.584859707864,31.1200779398788,2022-05-09
"浦东新区","上海市浦东新区环桥路1481弄",121.584859707864,31.1200779398788,2022-05-09
"浦东新区","上海市浦东新区荟萃新村",121.338402135266,31.8355999753659,2022-05-09
"浦东新区","上海市浦东新区季景路370弄",121.595858650359,31.342088287629,2022-05-09
"浦东新区","上海市浦东新区济阳路65弄",121.488308933346,31.1730161980026,2022-05-09
"浦东新区","上海市浦东新区金桥路2552弄",121.609184383785,31.2399130333655,2022-05-09
"浦东新区","上海市浦东新区金湘路201弄",121.619764626082,31.261871069581,2022-05-09
"浦东新区","上海市浦东新区金杨路660弄",121.588399929879,31.2575016841727,2022-05-09
"浦东新区","上海市浦东新区金杨路785弄",121.589437562574,31.2596987884712,2022-05-09
"浦东新区","上海市浦东新区锦和路289弄",121.54364599005,31.2106408345678,2022-05-09
"浦东新区","上海市浦东新区锦尊路306号",121.536847973272,31.188715953082,2022-05-09
"浦东新区","上海市浦东新区康桥路90弄",121.584859707864,31.1200779398788,2022-05-09
"浦东新区","上海市浦东新区康桥镇花墙村",121.55274169266,31.1563281752622,2022-05-09
"浦东新区","上海市浦东新区康桥镇太平村",121.560021740174,31.1293839649748,2022-05-09
"浦东新区","上海市浦东新区康沈路2132弄",121.584859707864,31.1200779398788,2022-05-09
"浦东新区","上海市浦东新区康士路15弄",121.569516739584,31.1556683987021,2022-05-09
"浦东新区","上海市浦东新区蓝村路470弄",121.531604025027,31.2174828969005,2022-05-09
"浦东新区","上海市浦东新区崂山三村",121.526396817478,31.2389325085635,2022-05-09
"浦东新区","上海市浦东新区崂山四村",121.524541996261,31.2411728108698,2022-05-09
"浦东新区","上海市浦东新区历城路100弄",121.4979155023,31.1798977733905,2022-05-09
"浦东新区","上海市浦东新区连波路26弄",121.558484380125,31.2008978485061,2022-05-09
"浦东新区","上海市浦东新区莲中路356弄",121.56492999165,31.1857610767685,2022-05-09
"浦东新区","上海市浦东新区林展路278弄",121.512901034818,31.1328058217041,2022-05-09
"浦东新区","上海市浦东新区林展路422弄",121.516191887223,31.149587574481,2022-05-09
"浦东新区","上海市浦东新区临沂路181弄",121.520668143579,31.1975792508032,2022-05-09
"浦东新区","上海市浦东新区灵山路1671弄",121.572311008704,31.2457713448707,2022-05-09
"浦东新区","上海市浦东新区灵山路2011弄",121.580017841165,31.2495250746587,2022-05-09
"浦东新区","上海市浦东新区凌兆路334弄",121.505458214346,31.1486761817732,2022-05-09
"浦东新区","上海市浦东新区凌兆路396弄",121.525530311983,31.1391594184198,2022-05-09
"浦东新区","上海市浦东新区柳杉路99弄",121.576397220807,31.2305088190269,2022-05-09
"浦东新区","上海市浦东新区龙东大道2895弄",121.64040094941,31.2308981166323,2022-05-09
"浦东新区","上海市浦东新区龙居路180弄",121.568971737631,31.2585512381558,2022-05-09
"浦东新区","上海市浦东新区龙阳路1188号",121.537174956478,31.2042222743912,2022-05-09
"浦东新区","上海市浦东新区罗山路108弄",121.558879454888,31.2546415897529,2022-05-09
"浦东新区","上海市浦东新区绿林路320弄",121.554834744499,31.1761626467343,2022-05-09
"浦东新区","上海市浦东新区马樱丹路127弄",121.925623459002,30.8891255273482,2022-05-09
"浦东新区","上海市浦东新区苗桥路928弄",121.602516621307,31.104273708865,2022-05-09
"浦东新区","上海市浦东新区苗桥路935弄",121.602516621307,31.104273708865,2022-05-09
"浦东新区","上海市浦东新区明月路888弄",121.595603980747,31.2425211036595,2022-05-09
"浦东新区","上海市浦东新区南港大道与环湖南三路交界口工地生活区",121.894828827476,30.9001927274634,2022-05-09
"浦东新区","上海市浦东新区南码头路1136弄",121.519727887202,31.1898749404218,2022-05-09
"浦东新区","上海市浦东新区欧高路138弄",121.584067851557,31.3553669703079,2022-05-09
"浦东新区","上海市浦东新区浦城路580弄",121.521080555639,31.230158967011,2022-05-09
"浦东新区","上海市浦东新区浦电路218号",121.530503780439,31.2254074271682,2022-05-09
"浦东新区","上海市浦东新区浦电路221号",121.530044566662,31.2249883073877,2022-05-09
"浦东新区","上海市浦东新区浦电路29弄",121.521798301741,31.2219827721666,2022-05-09
"浦东新区","上海市浦东新区浦电路48弄",121.523018290455,31.2247743849636,2022-05-09
"浦东新区","上海市浦东新区浦东大道136弄",121.520173536566,31.2440242095398,2022-05-09
"浦东新区","上海市浦东新区浦东大道140弄",121.521669035579,31.2440488314387,2022-05-09
"浦东新区","上海市浦东新区浦东大道1623弄",121.549043907859,31.2517675929144,2022-05-09
"浦东新区","上海市浦东新区浦东大道2639弄",121.573829414507,31.2700964028423,2022-05-09
"浦东新区","上海市浦东新区浦东大道2746弄",121.579756524092,31.2744655851279,2022-05-09
"浦东新区","上海市浦东新区浦东南路1288号",121.523559878847,31.2308961867454,2022-05-09
"浦东新区","上海市浦东新区浦东南路4705号",121.505914733206,31.1861087004819,2022-05-09
"浦东新区","上海市浦东新区浦东南路4950弄",121.504385996889,31.1857637026801,2022-05-09
"浦东新区","上海市浦东新区浦明路688弄",121.518068267772,31.2284627991959,2022-05-09
"浦东新区","上海市浦东新区栖霞路190弄",121.526081152921,31.2441861427874,2022-05-09
"浦东新区","上海市浦东新区清溪路365弄",121.578081633469,31.347103664356,2022-05-09
"浦东新区","上海市浦东新区乳山路161弄",121.528018079262,31.2415971840306,2022-05-09
"浦东新区","上海市浦东新区瑞福路52弄",121.607602647444,31.1017584182868,2022-05-09
"浦东新区","上海市浦东新区瑞浦路77弄",121.592640920022,31.1039600259099,2022-05-09
"浦东新区","上海市浦东新区三林路235号",121.502736528311,31.1436912572177,2022-05-09
"浦东新区","上海市浦东新区三林路88弄",121.536884264815,31.1897022555378,2022-05-09
"浦东新区","上海市浦东新区三林镇胡巷村张家宅",121.529586520682,31.1678359718402,2022-05-09
"浦东新区","上海市浦东新区三林镇临江村王家渡队王家渡",121.481034545157,31.1308233546774,2022-05-09
"浦东新区","上海市浦东新区三林镇临江村筠西队庞家宅",121.482806722267,31.124007039641,2022-05-09
"浦东新区","上海市浦东新区三林镇临江村周南队周家宅",121.478736410171,31.1240123722048,2022-05-09
"浦东新区","上海市浦东新区三林镇南阜村九思队九思堂",121.522537697007,31.1341302508085,2022-05-09
"浦东新区","上海市浦东新区三林镇天花庵村北陈队大陈家宅",121.531939542135,31.1285359001772,2022-05-09
"浦东新区","上海市浦东新区三林镇天花庵村南王家队南王家宅",121.55380142367,31.1628451123625,2022-05-09
"浦东新区","上海市浦东新区三林镇西林村圈门队西林街",121.505050473475,31.1424654028824,2022-05-09
"浦东新区","上海市浦东新区三林镇西林村万家队西林街",121.505050473475,31.1424654028824,2022-05-09
"浦东新区","上海市浦东新区三林镇西林村西林队金家宅",121.506713326804,31.1407565978205,2022-05-09
"浦东新区","上海市浦东新区三林镇懿德村小陈家队小陈家宅",121.524726687873,31.1243504097577,2022-05-09
"浦东新区","上海市浦东新区三舒路181弄",121.525530311983,31.1391594184198,2022-05-09
"浦东新区","上海市浦东新区三舒路62弄",121.509892699496,31.1304092986302,2022-05-09
"浦东新区","上海市浦东新区三旋路506弄",121.525530311983,31.1391594184198,2022-05-09
"浦东新区","上海市浦东新区上南路4265弄",121.519804782154,31.1518099263142,2022-05-09
"浦东新区","上海市浦东新区上南路5588号",121.534100685531,31.1291441675857,2022-05-09
"浦东新区","上海市浦东新区上南路6333弄",121.584859707864,31.1200779398788,2022-05-09
"浦东新区","上海市浦东新区上南路6500弄",121.584859707864,31.1200779398788,2022-05-09
"浦东新区","上海市浦东新区上南路6555弄",121.584859707864,31.1200779398788,2022-05-09
"浦东新区","上海市浦东新区上南路东明路交界口工地生活区",121.524156982519,31.16133938991,2022-05-09
"浦东新区","上海市浦东新区上浦路36弄",121.496318404934,31.15038414733,2022-05-09
"浦东新区","上海市浦东新区尚博路569弄",121.526700265079,31.1550331855514,2022-05-09
"浦东新区","上海市浦东新区申江路轲桥路交界口工地生活区",121.636677742563,31.2908116312254,2022-05-09
"浦东新区","上海市浦东新区申江南路7877号生活区",121.66098220661,31.0366623821219,2022-05-09
"浦东新区","上海市浦东新区沈梅路123弄",121.581743126728,31.0970363175052,2022-05-09
"浦东新区","上海市浦东新区盛夏路738弄",121.63560947765,31.2087697329582,2022-05-09
"浦东新区","上海市浦东新区世博家园大道站路94弄",121.545610314708,31.1654593463491,2022-05-09
"浦东新区","上海市浦东新区硕川路125弄",121.693519281334,31.2068003760843,2022-05-09
"浦东新区","上海市浦东新区唐镇大众村中心新村",121.654636127335,31.2345319459938,2022-05-09
"浦东新区","上海市浦东新区唐镇虹二村盛家宅",121.664209009833,31.2534517616121,2022-05-09
"浦东新区","上海市浦东新区唐镇吕三村百胜新村",121.645558660326,31.222123744433,2022-05-09
"浦东新区","上海市浦东新区唐镇暮二村顾家宅",121.682574057509,31.2244915217944,2022-05-09
"浦东新区","上海市浦东新区唐镇小湾村北街",121.697839941295,31.2397379836963,2022-05-09
"浦东新区","上海市浦东新区唐镇小湾村张家老宅",121.699658031698,31.2385939576616,2022-05-09
"浦东新区","上海市浦东新区唐镇新虹村东包家宅",121.654887203725,31.2451490146246,2022-05-09
"浦东新区","上海市浦东新区唐镇新虹村陆家宅",121.655033627523,31.2487133679639,2022-05-09
"浦东新区","上海市浦东新区唐镇新虹村赵家宅",121.655033627523,31.2487133679639,2022-05-09
"浦东新区","上海市浦东新区唐镇新镇村谢家宅",121.648514804098,31.2218474355031,2022-05-09
"浦东新区","上海市浦东新区塘桥路551弄",121.528023738587,31.2174478451229,2022-05-09
"浦东新区","上海市浦东新区微山二村",121.519896858468,31.2144186734285,2022-05-09
"浦东新区","上海市浦东新区潍坊路246号",121.538192916282,31.2332798755941,2022-05-09
"浦东新区","上海市浦东新区潍坊路252弄",121.538746182645,31.2332814194643,2022-05-09
"浦东新区","上海市浦东新区潍坊路262号",121.53947398977,31.2337598636256,2022-05-09
"浦东新区","上海市浦东新区潍坊路606号",121.528018797906,31.2292048956976,2022-05-09
"浦东新区","上海市浦东新区潍坊西路1弄",121.550454606832,31.2273482924363,2022-05-09
"浦东新区","上海市浦东新区五莲路108弄",121.588773624971,31.2771578731139,2022-05-09
"浦东新区","上海市浦东新区五莲路759弄",121.597702871571,31.2763872229612,2022-05-09
"浦东新区","上海市浦东新区下南路161弄",121.549904215046,31.1727314791562,2022-05-09
"浦东新区","上海市浦东新区下南路370弄",121.536884264815,31.1897022555378,2022-05-09
"浦东新区","上海市浦东新区新场镇果园村",121.642441899529,31.025361102765,2022-05-09
"浦东新区","上海市浦东新区新场镇坦东村连南",121.671592631972,31.0893528210614,2022-05-09
"浦东新区","上海市浦东新区新场镇坦南村",121.65884962933,31.0724938878595,2022-05-09
"浦东新区","上海市浦东新区新场镇坦西村坦北",121.651215559614,31.0897996061926,2022-05-09
"浦东新区","上海市浦东新区新浦路673弄",121.536884264815,31.1897022555378,2022-05-09
"浦东新区","上海市浦东新区新元南路正茂路交界口工地生活区",121.82788341782,30.8836711316312,2022-05-09
"浦东新区","上海市浦东新区新园路206弄",121.637891982121,31.3207879128424,2022-05-09
"浦东新区","上海市浦东新区秀康路958弄",121.584859707864,31.1200779398788,2022-05-09
"浦东新区","上海市浦东新区秀沿路1177弄",121.584859707864,31.1200779398788,2022-05-09
"浦东新区","上海市浦东新区秀沿路2875弄",121.616066481959,31.1449302308223,2022-05-09
"浦东新区","上海市浦东新区宣中路621弄",121.710959164166,31.0304685727415,2022-05-09
"浦东新区","上海市浦东新区雪野路34弄",121.503822310181,31.1865529402405,2022-05-09
"浦东新区","上海市浦东新区严桥路150弄",121.53448201622,31.1955148268081,2022-05-09
"浦东新区","上海市浦东新区杨高南路5777弄3支弄",121.550326957619,31.134223831037,2022-05-09
"浦东新区","上海市浦东新区杨南路694弄",121.507554859406,31.1553909666812,2022-05-09
"浦东新区","上海市浦东新区杨思新村",121.600645630591,31.2244171774298,2022-05-09
"浦东新区","上海市浦东新区杨新路198弄",121.498479727991,31.1692324410427,2022-05-09
"浦东新区","上海市浦东新区洋泾街道泾南村东唐家宅",121.49818274819,31.1917176907395,2022-05-09
"浦东新区","上海市浦东新区耀华路331弄",121.493188888199,31.1809682021446,2022-05-09
"浦东新区","上海市浦东新区耀华路414弄",121.492226982658,31.1790527910542,2022-05-09
"浦东新区","上海市浦东新区耀华路421弄",121.489669776363,31.1813858197461,2022-05-09
"浦东新区","上海市浦东新区耀华路500弄",121.488759343729,31.1767943182538,2022-05-09
"浦东新区","上海市浦东新区耀华路560号",121.488000006081,31.1774534827976,2022-05-09
"浦东新区","上海市浦东新区永泰路1650弄",121.543420425536,31.1503996769566,2022-05-09
"浦东新区","上海市浦东新区云山路1039弄",121.578964667785,31.2560144614311,2022-05-09
"浦东新区","上海市浦东新区枣庄路210弄",121.577389219582,31.2643915592667,2022-05-09
"浦东新区","上海市浦东新区张江镇劳动村吴家宅北",121.639015941975,31.18527126574,2022-05-09
"浦东新区","上海市浦东新区张江镇中心村周家圈宅",121.672482134088,31.1831283317038,2022-05-09
"浦东新区","上海市浦东新区张杨路1647弄",121.547319969755,31.2416676554149,2022-05-09
"浦东新区","上海市浦东新区张杨路1673弄",121.549771894644,31.2433326325524,2022-05-09
"浦东新区","上海市浦东新区招远路19弄",121.521229943845,31.2416451169276,2022-05-09
"浦东新区","上海市浦东新区赵高路610号",121.633474115623,31.3217408948772,2022-05-09
"浦东新区","上海市浦东新区周康路169弄",121.579222122145,31.1159988876931,2022-05-09
"浦东新区","上海市浦东新区周浦镇沈西村",121.572071969607,31.0966482420378,2022-05-09
"浦东新区","上海市浦东新区周浦镇瓦南村陆弄",121.65220621093,31.1034918958276,2022-05-09
"浦东新区","上海市浦东新区周泰路32弄",121.607434035499,31.107255809072,2022-05-09
"浦东新区","上海市浦东新区周祝公路4022号工地生活区",121.760765920432,31.1241046056251,2022-05-09
"浦东新区","上海市浦东新区祝桥镇立新村",121.763918136693,31.1774717113271,2022-05-09
"浦东新区","上海市浦东新区梓康路580弄",121.567316070746,31.1288750806472,2022-05-09
"浦东新区","上海市浦东新区紫叶路51弄",121.557614011916,31.1902708942297,2022-05-09
"浦东新区","上海市浦东新区邹平路191号工地生活区",121.521600584699,31.1763068548283,2022-05-09
"黄浦区","上海市黄浦区保屯路211弄",121.498305816045,31.209535149529,2022-05-09
"黄浦区","上海市黄浦区北京东路288弄",121.490646324283,31.2464802699138,2022-05-09
"黄浦区","上海市黄浦区北京西路218弄",121.476082007219,31.242234743581,2022-05-09
"黄浦区","上海市黄浦区北京西路240弄",121.475833086762,31.2420176187645,2022-05-09
"黄浦区","上海市黄浦区北京西路256号",121.475433161149,31.2417952447631,2022-05-09
"黄浦区","上海市黄浦区北京西路278号",121.47510725591,31.241667269482,2022-05-09
"黄浦区","上海市黄浦区曹家街45号",121.492972037248,31.2246563452789,2022-05-09
"黄浦区","上海市黄浦区曹家街54号",121.492911671118,31.2245088919645,2022-05-09
"黄浦区","上海市黄浦区曹家街55弄",121.492035823246,31.2392520698501,2022-05-09
"黄浦区","上海市黄浦区曹市弄42弄",121.495654826654,31.2249117246057,2022-05-09
"黄浦区","上海市黄浦区曹市弄57弄",121.495654826654,31.2249117246057,2022-05-09
"黄浦区","上海市黄浦区成都南路99弄",121.474386096247,31.227539744289,2022-05-09
"黄浦区","上海市黄浦区长乐路117号",121.473963174013,31.2278697662202,2022-05-09
"黄浦区","上海市黄浦区重庆北路106号",121.476989116123,31.2315367526421,2022-05-09
"黄浦区","上海市黄浦区重庆北路177弄",121.476319968349,31.2325548713123,2022-05-09
"黄浦区","上海市黄浦区重庆南路169弄",121.478156104811,31.2231556302522,2022-05-09
