"district","address","lng","lat","date"
"浦东新区","上海市浦东新区潍坊路335弄3支弄",121.537886953425,31.2356150274071,2022-06-01
"浦东新区","上海市浦东新区樱花路801弄",121.567035979088,31.214397826977,2022-06-01
"静安区","上海市静安区闻喜路590号",121.463023070529,31.3147160386864,2022-06-01
"静安区","上海市静安区芷江西路220弄",121.468844180064,31.2632441437441,2022-06-01
"长宁区","上海市长宁区东诸安浜路180弄",121.431390230131,31.2257197778783,2022-06-01
"虹口区","上海市虹口区中山北一路131弄1支弄",121.483567587034,31.2788864889531,2022-06-01
"虹口区","上海市虹口区广中路366弄",121.480457204206,31.2837614545883,2022-06-01
"青浦区","上海市青浦区崧泽大道333号",121.308617558455,31.1962050582445,2022-06-01
"青浦区","上海市青浦区已对相关居住地落实终末消毒措施等",121.130553104673,31.1554543179807,2022-06-01
